[
    {
        "id": 1,
        "theme": "Devotion",
        "title_english": "The Merchant and the Mare: A Parable of Nav Vidha Bhakti",
        "title_hindi": "व्यापारी और घोड़ी की कथा: नवधा भक्ति का सार",
        "description": "### The Cryptic Parable of Humility and Devotion\n\nIn **Chapter 21** of the *Sai Satcharitra*, Sai Baba narrates a profound yet cryptic parable to his devotee, Anantrao Patankar, who was desperately seeking peace of mind (Shanti).\n\n1. **The Story:** Baba told Patankar of a merchant who, during his journey, found peace only after he gathered **nine balls of horse dung** dropped by a mare and kept them safely.\n2. **The Symbolism:**\n   * **The Mare:** Represents the swift **Divine Grace** or the Guru's immense compassion, which is freely offered.\n   * **The Nine Dung Balls:** These symbolize the **Nav Vidha Bhakti** (the nine forms of devotion: *Shravana*, *Kirtana*, *Smarana*, etc.).\n   * **The Act of Gathering:** This is the most critical element. It represents absolute **humility** and the complete crushing of the ego. To attain the fruits of devotion, one must be willing to bend low and accept even the humblest, most outwardly unpleasant offering from the Divine.\n\n**The Core Teaching:** The *Bodhakatha* emphasizes that spiritual peace is not attained through intellectual seeking or bookish knowledge alone. It is achieved only through the **sincere, ego-less practice of the nine forms of devotion**. One must cultivate the humility to receive God's grace in whatever form it manifests.",
        "youtube_id": "9YXn7kRfSak",
        "keywords": [
            "Nav Vidha Bhakti",
            "Parable",
            "Devotion",
            "Peace",
            "Humility",
            "Nine Forms of Devotion"
        ],
        "social_tags": [
            "#SaiTeachings",
            "#NavVidhaBhakti",
            "#SpiritualWisdom",
            "#SaiParable"
        ]
    },
    {
        "id": 2,
        "theme": "Self-Realization",
        "title_english": "The Quest for Brahma Jnana: The Story of Four Friends",
        "title_hindi": "ब्रह्मज्ञान की खोज: चार मित्रों की कहानी",
        "description": "### The Guru, The Friends, and The Forest of Ignorance\n\nThis *Bodhakatha*, recounted in **Chapter 32**, is one of Baba’s most personal and deep-seated teachings on the nature of *Brahma Jnana* (Knowledge of the Absolute).\n\n* **The Seekers:** Baba and three intellectual companions embarked on a journey to find God in a dense forest (representing the spiritual path fraught with Maya, or illusion).\n* **The Intellectual Obstacle:** When they were exhausted, a compassionate **Vanjari (Nomad)** appeared, offering them water and simple bread (Prasad). The three intellectual friends, blinded by the pride of their caste and knowledge, rejected the Nomad's offering, deeming him low and unfit to be a guide.\n* **Baba's Surrender:** Baba immediately recognized the Nomad's selfless compassion and accepted the bread and water. He understood that the one who comes to alleviate suffering is the *Sadguru*.\n\n**The Core Teaching:** The story reveals that **Intellect is a great impediment to realization**. The Nomad is the **Sadguru** in disguise. The bread and water symbolize the **Guru's Grace**. True Brahma Jnana cannot be found through rigid austerities or intellectual study. It is only granted when the seeker completely **surrenders their ego** and accepts the compassion and guidance of the Sadguru, thereby transcending the illusionary forest of the material world.",
        "youtube_id": "wSaVdS67CKc",
        "keywords": [
            "Brahma Jnana",
            "Guru Grace",
            "Intellect vs Devotion",
            "Quest for God",
            "Surrender",
            "Sadguru"
        ],
        "social_tags": [
            "#BrahmaJnana",
            "#GuruKripa",
            "#SaiWisdom",
            "#TrueGuru"
        ]
    },
    {
        "id": 3,
        "theme": "Karma Yoga",
        "title_english": "The Labour of Sai: A Lesson in Nishkama Karma",
        "title_hindi": "साई का निष्काम कर्म योग: श्रम का महत्व",
        "description": "### The Art of Working without Attachment\n\nSai Baba didn't just preach *Nishkama Karma Yoga* (the Yoga of Selfless Action); He lived it, and this *Bodhakatha* offers a personal glimpse into his practice. Baba narrates his own experience of being an extremely diligent and skilled laborer working at a loom.\n\n* **Dedication to Work:** He emphasized the necessity of working with full focus, skill, and honesty. His diligence earned him a high reward (more than others).\n* **Detachment and Charity:** The profound lesson lies in his subsequent actions. Instead of using the money for himself or hoarding it, Baba gave **all his earnings away to the needy and for charitable purposes**.\n\n**The Core Teaching:** This teaching crystallizes the essence of the Bhagavad Gita's philosophy: **perform your duty (Karma) with complete effort and excellence, but remain absolutely detached from the fruits (Phala)**. It encourages the devotee to purify their mind (*Chitta Shuddhi*) by using the resources gained through their labor for the welfare of others, treating their work as an act of worship (*Seva*).",
        "youtube_id": "SiSzvKo3MJ0",
        "keywords": [
            "Nishkama Karma",
            "Selfless Service",
            "Hard Work",
            "Detachment",
            "Karma Yoga",
            "Chitta Shuddhi"
        ],
        "social_tags": [
            "#KarmaYoga",
            "#SelflessService",
            "#SaiWork",
            "#GitaEssence"
        ]
    },
    {
        "id": 4,
        "theme": "Inner Transformation",
        "title_english": "The Clay Pot and Water: Quenching the True Thirst",
        "title_hindi": "मटका और पानी: सच्ची प्यास",
        "description": "### Seeking Nectar in the Illusionary World\n\nThis metaphorical teaching, often delivered through a song or simple analogy, explains the futility of chasing material happiness. It addresses the fundamental human search for lasting satisfaction.\n\n* **The Clay Pot (Mundane World):** The pot represents the physical body, the material world, and all transient, external pleasures (wealth, fame, relationships). The pot itself is dry and cannot alleviate the inner spiritual suffering.\n* **The Water (Spiritual Essence):** The water contained within the pot symbolizes the *Atman* (Soul), spiritual knowledge, and the ultimate bliss of salvation.\n\n**The Core Teaching:** The analogy states that one cannot quench their thirst by merely **licking the outside of a clay pot**. Similarly, we spend our lives seeking satisfaction by grasping at the external forms of the world, which ultimately leave us thirsty. True, eternal satisfaction is found only by turning inward and drinking the **nectar of the spiritual essence** contained within, which is attained through devotion and self-inquiry.",
        "youtube_id": "QpZ_-Uls-cI",
        "keywords": [
            "Materialism",
            "Spirituality",
            "Thirst",
            "Atman",
            "Illusion",
            "Inner Peace"
        ],
        "social_tags": [
            "#SpiritualGrowth",
            "#InnerPeace",
            "#SaiUpdesh",
            "#Maya"
        ]
    },
    {
        "id": 5,
        "theme": "Spiritual Evolution",
        "title_english": "From Devotion to Avatar: The Soul's Journey",
        "title_hindi": "भक्ति से अवतार तक: आत्मा की यात्रा",
        "description": "### The Path from Jiva to Shiva: Man Becomes Narayan\n\nThis discourse articulates the profound truth regarding the nature of the *Avatar* (Divine Incarnation). It proposes that an Avatar is not a sudden, arbitrary descent of God, but the **climax of a perfected soul's spiritual evolution**.\n\n**The Four Stages of Perfection:**\n1. **Devotion:** The starting point, characterized by simple, selfless worship.\n2. **Purification:** The soul engages in *Nishkama Karma* and *Upasana* to cleanse the mind of impurities (ego, desires, ignorance).\n3. **Realization:** The achieved state of *Tattva Jnana*, where the soul recognizes its eternal, non-dual identity with the Absolute (*Brahman*).\n4. **Avatar:** The fully realized soul, having transcended the need for liberation, chooses to return to the world in a physical form to act as the *Sadguru*, guiding and uplifting humanity.\n\n**The Core Teaching:** The teaching emphasizes the potential within every human being: **\"Man becomes Narayan.\"** Sai Baba, therefore, is presented not just as a miracle-worker but as a *Purna Purusha* (Perfected Being) who has successfully traversed this path from *Jiva* (individual soul) to *Shiva* (the Absolute), setting the highest spiritual ideal for all devotees.",
        "youtube_id": "GoV5ZVP9cpo",
        "keywords": [
            "Avatar",
            "Evolution",
            "Self-Realization",
            "Brahman",
            "Advaita",
            "Jiva to Shiva"
        ],
        "social_tags": [
            "#SaiAvatar",
            "#SpiritualEvolution",
            "#AdvaitaVedanta",
            "#SoulJourney"
        ]
    },
    {
        "id": 6,
        "theme": "Spiritual Pillars",
        "title_english": "The Two Pillars of Shirdi: Shraddha and Saburi",
        "title_hindi": "शिर्डी के दो स्तंभ: श्रद्धा और सबूरी",